{"kind":"quent_review_ci","version":1,"analysis_version":1,"state":"incomplete","exit":3,"selection":"explicit_set","explicit_inputs_processed":0,"base_inputs_processed":0,"explicit_set":"missing","git_head":"unverified","runtime":"unverified","authority":"not_granted","public_budget_exceeded":false,"diagnostic_count":0,"hidden_count":0,"diagnostics":[],"head_results":[],"base_results":[]}
